{
  "$schema": "http://json-schema.org/draft-07/schema#",
  "$id": "https://ecole-adaptive.local/schemas/content-package-1.json",
  "type": "object",
  "additionalProperties": false,
  "required": [
    "packageVersion",
    "id",
    "version",
    "contentHash",
    "createdAt",
    "studentIds",
    "subject",
    "grade",
    "chapter",
    "title",
    "modes",
    "questionBank",
    "tests"
  ],
  "properties": {
    "packageVersion": {
      "const": 1
    },
    "id": {
      "type": "string",
      "minLength": 1,
      "maxLength": 100,
      "pattern": "^[a-zA-Z0-9][a-zA-Z0-9_.-]*$"
    },
    "version": {
      "type": "integer",
      "minimum": 1
    },
    "contentHash": {
      "type": "string",
      "pattern": "^[a-f0-9]{64}$"
    },
    "createdAt": {
      "type": "string",
      "pattern": "^\\d{4}-\\d{2}-\\d{2}T\\d{2}:\\d{2}:\\d{2}(?:\\.\\d{1,3})?Z$"
    },
    "studentIds": {
      "type": "array",
      "minItems": 1,
      "uniqueItems": true,
      "items": {
        "type": "string",
        "minLength": 1,
        "maxLength": 100,
        "pattern": "^[a-zA-Z0-9][a-zA-Z0-9_.-]*$"
      }
    },
    "subject": {
      "type": "string",
      "minLength": 1,
      "maxLength": 100,
      "pattern": "^[a-zA-Z0-9][a-zA-Z0-9_.-]*$"
    },
    "grade": {
      "type": "string",
      "minLength": 1,
      "maxLength": 10000,
      "pattern": "\\S"
    },
    "chapter": {
      "type": "string",
      "minLength": 1,
      "maxLength": 10000,
      "pattern": "\\S"
    },
    "title": {
      "type": "string",
      "minLength": 1,
      "maxLength": 10000,
      "pattern": "\\S"
    },
    "modes": {
      "type": "array",
      "minItems": 1,
      "maxItems": 2,
      "uniqueItems": true,
      "items": {
        "enum": ["learn", "exam"]
      }
    },
    "questionBank": {
      "$ref": "https://ecole-adaptive.local/schemas/question-bank-1.0.json"
    },
    "tests": {
      "type": "array",
      "maxItems": 100,
      "items": {
        "type": "object",
        "additionalProperties": false,
        "required": ["id", "title", "mode", "durationMinutes", "questionIds"],
        "properties": {
          "id": {
            "type": "string",
            "minLength": 1,
            "maxLength": 100,
            "pattern": "^[a-zA-Z0-9][a-zA-Z0-9_.-]*$"
          },
          "title": {
            "type": "string",
            "minLength": 1,
            "maxLength": 10000,
            "pattern": "\\S"
          },
          "mode": {
            "const": "exam"
          },
          "durationMinutes": {
            "enum": [10, 20, 30, 40, 45, 60]
          },
          "questionIds": {
            "type": "array",
            "minItems": 1,
            "maxItems": 1000,
            "uniqueItems": true,
            "items": {
              "type": "string",
              "minLength": 1,
              "maxLength": 100,
              "pattern": "^[a-zA-Z0-9][a-zA-Z0-9_.-]*$"
            }
          },
          "seed": {
            "type": "integer",
            "minimum": 0,
            "maximum": 4294967295
          },
          "skillDistribution": {
            "type": "object",
            "minProperties": 1,
            "propertyNames": {
              "type": "string",
              "minLength": 1,
              "maxLength": 100,
              "pattern": "^[a-zA-Z0-9][a-zA-Z0-9_.-]*$"
            },
            "additionalProperties": {
              "type": "number",
              "minimum": 0,
              "maximum": 100
            }
          },
          "difficultyDistribution": {
            "type": "object",
            "minProperties": 1,
            "propertyNames": {
              "enum": ["1", "2", "3", "4"]
            },
            "additionalProperties": {
              "type": "number",
              "minimum": 0,
              "maximum": 100
            }
          }
        }
      }
    }
  }
}
