{
  "packageVersion": 1,
  "id": "course-d2a1996816f74899a1b41f08b6ded3a7",
  "version": 1,
  "title": "Der Totalitarismus in der UdSSR",
  "subject": "history_geography",
  "grade": "3eme",
  "chapter": "Der Totalitarismus in der UdSSR",
  "studentIds": [
    "max"
  ],
  "createdAt": "2026-10-14T14:52:15.919Z",
  "modes": [
    "learn",
    "exam"
  ],
  "questionBank": {
    "schemaVersion": "1.0",
    "id": "course-d2a1996816f74899a1b41f08b6ded3a7",
    "version": 1,
    "title": "Der Totalitarismus in der UdSSR",
    "subject": "history_geography",
    "chapter": "Der Totalitarismus in der UdSSR",
    "grade": "3eme",
    "language": "de",
    "studentIds": [
      "max"
    ],
    "isDemo": false,
    "sourceNotice": "Der Aufgabenpool stützt sich ausschließlich auf die bestätigten Quellen auf den Seiten 1–2 der fiche-eleves-3-lesbar.pdf. Zahlenwerte zur Repression sind im Quellenmodell nicht enthalten; deshalb werden keine Zahlenaufgaben ergänzt. Der Pool umfasst 12 fachlich belastbare Aufgaben.",
    "skills": [
      {
        "id": "history_geography.totalitarismus_udssr.analyse_bildquelle",
        "name": "Bildquellen analysieren",
        "subject": "history_geography",
        "chapter": "Der Totalitarismus in der UdSSR",
        "description": "Personen, Symbole und dargestellte Botschaften auf den Propagandaplakaten beschreiben."
      },
      {
        "id": "history_geography.totalitarismus_udssr.analyse_textquelle",
        "name": "Textquellen analysieren",
        "subject": "history_geography",
        "chapter": "Der Totalitarismus in der UdSSR",
        "description": "Aussagen aus den Reden und dem Brief herausarbeiten und mit den dargestellten Herrschaftsmethoden in Verbindung bringen."
      },
      {
        "id": "history_geography.totalitarismus_udssr.zahlen_deuten",
        "name": "Historische Zahlen auswerten",
        "subject": "history_geography",
        "chapter": "Der Totalitarismus in der UdSSR",
        "description": "Zahlen zu Verhaftungen, Verurteilungen, Hinrichtungen und Gulag-Häftlingen zeitlich einordnen und beschreiben."
      }
    ],
    "sourceRefs": [
      {
        "id": "src-7aef0ede67524b16be944eac649ce217-p1",
        "label": "fiche-eleves-3-lesbar.pdf, Seite 1",
        "kind": "pdf"
      },
      {
        "id": "src-7aef0ede67524b16be944eac649ce217-p2",
        "label": "fiche-eleves-3-lesbar.pdf, Seite 2",
        "kind": "pdf"
      }
    ],
    "durationMinutes": 30,
    "questionCount": 12,
    "questions": [
      {
        "id": "q01",
        "subject": "history_geography",
        "chapter": "Der Totalitarismus in der UdSSR",
        "skillIds": [
          "history_geography.totalitarismus_udssr.analyse_bildquelle"
        ],
        "difficulty": 1,
        "points": 1.0,
        "questionType": "multiple_choice",
        "question": "Welche drei Figuren zeigt das Propagandaplakat gemeinsam?",
        "instruction": "Wähle die passende Antwort.",
        "acceptedAnswers": [
          "b"
        ],
        "correctAnswer": "b",
        "explanationSteps": [
          "Das Quellenmodell nennt drei dargestellte Figuren.",
          "Es sind ein Soldat, ein Arbeiter und ein Bauer."
        ],
        "hint": "Die Figuren vertreten verschiedene Tätigkeiten.",
        "secondHint": "Eine Figur ist beim Militär, eine arbeitet und eine ist in der Landwirtschaft tätig.",
        "memoryRule": "Auf dem Plakat stehen Soldat, Arbeiter und Bauer gemeinsam.",
        "commonMistake": "Eine der drei Figuren auszulassen oder durch eine nicht genannte Figur zu ersetzen.",
        "sourceRefs": [
          "src-7aef0ede67524b16be944eac649ce217-p1"
        ],
        "estimatedSeconds": 45,
        "choices": [
          {
            "id": "a",
            "text": "Bergmann, Kind und Soldat"
          },
          {
            "id": "b",
            "text": "Soldat, Arbeiter und Bauer"
          },
          {
            "id": "c",
            "text": "Stalin, Arbeiter und Bergmann"
          },
          {
            "id": "d",
            "text": "Bauer, Kind und Bergmann"
          }
        ]
      },
      {
        "id": "q02",
        "subject": "history_geography",
        "chapter": "Der Totalitarismus in der UdSSR",
        "skillIds": [
          "history_geography.totalitarismus_udssr.analyse_bildquelle"
        ],
        "difficulty": 1,
        "points": 1.0,
        "questionType": "short_text",
        "question": "Vor welchen Gegnern zeigt das Plakat Soldat, Arbeiter und Bauer?",
        "instruction": "Antworte mit einer kurzen, genauen Aussage.",
        "acceptedAnswers": [
          "Vor als kapitalistisch bezeichneten Gegnern.",
          "Vor kapitalistischen Gegnern."
        ],
        "correctAnswer": "Vor als kapitalistisch bezeichneten Gegnern.",
        "explanationSteps": [
          "Das Quellenmodell beschreibt die Gegner auf dem Plakat.",
          "Sie werden als kapitalistisch bezeichnet."
        ],
        "hint": "Die Antwort beschreibt, wie die Gegner im Begleittext eingeordnet werden.",
        "secondHint": "Das gesuchte Wort beginnt mit „kapitalistisch“.",
        "memoryRule": "Das Plakat stellt die drei Figuren vor als kapitalistisch bezeichneten Gegnern dar.",
        "commonMistake": "Die Gegner als konkrete Länder zu benennen; das Quellenmodell nennt sie hier nur als kapitalistisch bezeichnet.",
        "sourceRefs": [
          "src-7aef0ede67524b16be944eac649ce217-p1"
        ],
        "estimatedSeconds": 60
      },
      {
        "id": "q03",
        "subject": "history_geography",
        "chapter": "Der Totalitarismus in der UdSSR",
        "skillIds": [
          "history_geography.totalitarismus_udssr.analyse_bildquelle"
        ],
        "difficulty": 2,
        "points": 1.0,
        "questionType": "multiple_choice",
        "question": "Wovor warnt der Begleittext zum Propagandaplakat?",
        "instruction": "Wähle die passende Antwort.",
        "acceptedAnswers": [
          "c"
        ],
        "correctAnswer": "c",
        "explanationSteps": [
          "Der Begleittext ergänzt die Botschaft des Plakats.",
          "Laut Quellenmodell warnt er vor einer Intervention kapitalistischer Länder gegen die UdSSR."
        ],
        "hint": "Es geht um eine mögliche Handlung von Ländern gegen die UdSSR.",
        "secondHint": "Gesucht ist eine Warnung vor einem Eingreifen.",
        "memoryRule": "Der Begleittext warnt vor einer Intervention kapitalistischer Länder gegen die UdSSR.",
        "commonMistake": "Die Warnung mit der gemeinsamen Darstellung von Soldat, Arbeiter und Bauer zu verwechseln.",
        "sourceRefs": [
          "src-7aef0ede67524b16be944eac649ce217-p1"
        ],
        "estimatedSeconds": 60,
        "choices": [
          {
            "id": "a",
            "text": "Vor der Rückkehr zur individuellen Kleinwirtschaft"
          },
          {
            "id": "b",
            "text": "Vor dem Einsatz von Maschinen in der Landwirtschaft"
          },
          {
            "id": "c",
            "text": "Vor einer Intervention kapitalistischer Länder gegen die UdSSR"
          },
          {
            "id": "d",
            "text": "Vor einer Botschaft der Bergleute an Stalin"
          }
        ]
      },
      {
        "id": "q04",
        "subject": "history_geography",
        "chapter": "Der Totalitarismus in der UdSSR",
        "skillIds": [
          "history_geography.totalitarismus_udssr.analyse_textquelle"
        ],
        "difficulty": 1,
        "points": 1.0,
        "questionType": "short_text",
        "question": "Wie heißt die Umstellung von individueller Kleinwirtschaft auf gemeinsame, große Landwirtschaft?",
        "instruction": "Nenne den passenden Begriff.",
        "acceptedAnswers": [
          "Zwangskollektivierung"
        ],
        "correctAnswer": "Zwangskollektivierung",
        "explanationSteps": [
          "Die Definition beschreibt den Wechsel von individueller Kleinwirtschaft zu gemeinsamer, großer Landwirtschaft.",
          "Dieser Vorgang heißt Zwangskollektivierung."
        ],
        "hint": "Gesucht ist der Fachbegriff für die radikale Umstellung der Landwirtschaft.",
        "secondHint": "Der Begriff beginnt mit „Zwangs-“.",
        "memoryRule": "Zwangskollektivierung bezeichnet die radikale Umstellung auf gemeinsame, große Landwirtschaft.",
        "commonMistake": "Den Begriff mit dem kapitalistischen Wirtschaftssystem zu verwechseln.",
        "sourceRefs": [
          "src-7aef0ede67524b16be944eac649ce217-p1"
        ],
        "estimatedSeconds": 45
      },
      {
        "id": "q05",
        "subject": "history_geography",
        "chapter": "Der Totalitarismus in der UdSSR",
        "skillIds": [
          "history_geography.totalitarismus_udssr.analyse_textquelle"
        ],
        "difficulty": 2,
        "points": 1.0,
        "questionType": "multiple_choice",
        "question": "Welchen Wechsel beschreibt Stalins Rede als sozialistischen Entwicklungsweg?",
        "instruction": "Wähle die passende Antwort.",
        "acceptedAnswers": [
          "a"
        ],
        "correctAnswer": "a",
        "explanationSteps": [
          "Die Rede behandelt laut Quellenmodell die Landwirtschaft.",
          "Sie beschreibt den Wechsel von individueller Kleinwirtschaft zu kollektiver Großlandwirtschaft."
        ],
        "hint": "Es geht um zwei unterschiedliche Formen der Landwirtschaft.",
        "secondHint": "Die eine Form besteht aus kleinen individuellen Betrieben, die andere ist kollektiv und groß.",
        "memoryRule": "Stalins Rede stellt den Übergang zur kollektiven Großlandwirtschaft als sozialistischen Entwicklungsweg dar.",
        "commonMistake": "Den beschriebenen Wechsel mit einer Änderung des Eigentums- oder Profitprinzips gleichzusetzen.",
        "sourceRefs": [
          "src-7aef0ede67524b16be944eac649ce217-p1"
        ],
        "estimatedSeconds": 60,